{
  "$schema": "https://json-schema.org/draft/2020-12/schema",
  "title": "shadcn/ui parity baseline",
  "type": "object",
  "required": ["source", "retrievedAt", "components"],
  "properties": {
    "source": { "type": "string" },
    "retrievedAt": { "type": "string" },
    "description": { "type": "string" },
    "components": {
      "type": "array",
      "items": { "type": "string" },
      "uniqueItems": true
    }
  }
}
