{
  "$schema": "../schema/shadcn-parity.schema.json",
  "source": "https://ui.shadcn.com/docs/components",
  "retrievedAt": "2026-06-12",
  "description": "Current shadcn/ui components index used as the parity baseline for @clean99/liquid-glass.",
  "components": [
    "accordion",
    "alert",
    "alert-dialog",
    "aspect-ratio",
    "avatar",
    "badge",
    "breadcrumb",
    "button",
    "button-group",
    "calendar",
    "card",
    "carousel",
    "chart",
    "checkbox",
    "collapsible",
    "combobox",
    "command",
    "context-menu",
    "data-table",
    "date-picker",
    "dialog",
    "direction",
    "drawer",
    "dropdown-menu",
    "empty",
    "field",
    "hover-card",
    "input",
    "input-group",
    "input-otp",
    "item",
    "kbd",
    "label",
    "menubar",
    "native-select",
    "navigation-menu",
    "pagination",
    "popover",
    "progress",
    "radio-group",
    "resizable",
    "scroll-area",
    "select",
    "separator",
    "sheet",
    "sidebar",
    "skeleton",
    "slider",
    "sonner",
    "spinner",
    "switch",
    "table",
    "tabs",
    "textarea",
    "toast",
    "toggle",
    "toggle-group",
    "tooltip",
    "typography"
  ]
}
